Title,Link,Date_Posted,Scraped_At
Uncanny Owl: WordPress Developer,https://weworkremotely.com/remote-jobs/uncanny-owl-wordpress-developer,"Wed, 04 Feb 2026 21:57:47 +0000",2026-02-28
Zipdev: Senior Web Developer,https://weworkremotely.com/remote-jobs/zipdev-senior-web-developer,"Wed, 04 Feb 2026 17:40:19 +0000",2026-02-28
"Linkage Web Development: ASP.NET Developer (C#, MVC, SQL Server, JavaScript)",https://weworkremotely.com/remote-jobs/linkage-web-development-asp-net-developer-c-mvc-sql-server-javascript,"Wed, 04 Feb 2026 17:40:19 +0000",2026-02-28
Anexia Internetdienstleistungs: QA Engineer (M/W/D),https://weworkremotely.com/remote-jobs/anexia-internetdienstleistungs-qa-engineer-m-w-d,"Wed, 04 Feb 2026 17:40:16 +0000",2026-02-28
"Speechify Inc: Software Engineer, iOS Core Product",https://weworkremotely.com/remote-jobs/speechify-inc-software-engineer-ios-core-product,"Wed, 09 Jul 2025 15:35:11 +0000",2026-02-28
Rapid Strategy: Senior Penetration Tester (WebApp and Network),https://weworkremotely.com/remote-jobs/rapid-strategy-senior-penetration-tester-webapp-and-network,"Tue, 03 Feb 2026 18:40:23 +0000",2026-02-28
"WeVote: Fundraiser, Volunteer Ambassador",https://weworkremotely.com/remote-jobs/wevote-fundraiser-volunteer-ambassador,"Tue, 03 Feb 2026 18:40:23 +0000",2026-02-28
OnTheGoSystems: Senior PHP Developer ,https://weworkremotely.com/remote-jobs/onthegosystems-senior-php-developer-3,"Tue, 03 Feb 2026 06:16:03 +0000",2026-02-28
Cortes 23: Software Engineer,https://weworkremotely.com/remote-jobs/cortes-23-software-engineer-3,"Mon, 02 Feb 2026 19:45:09 +0000",2026-02-28
DreamRider Productions Careers: Web Developer,https://weworkremotely.com/remote-jobs/dreamrider-productions-careers-web-developer,"Mon, 02 Feb 2026 15:10:52 +0000",2026-02-28
Walker Smith: Senior Web Developer (Remote),https://weworkremotely.com/remote-jobs/walker-smith-senior-web-developer-remote,"Mon, 02 Feb 2026 15:10:52 +0000",2026-02-28
Webflow: Enterprise Account Executive - West,https://weworkremotely.com/remote-jobs/webflow-enterprise-account-executive-west,"Mon, 02 Feb 2026 15:10:52 +0000",2026-02-28
Dealer eProcess: Regional Sales Executive (Account Manager),https://weworkremotely.com/remote-jobs/dealer-eprocess-regional-sales-executive-account-manager-1,"Mon, 02 Feb 2026 15:09:46 +0000",2026-02-28
NuTechs: FPGA Development Engineer,https://weworkremotely.com/remote-jobs/nutechs-fpga-development-engineer,"Mon, 02 Feb 2026 15:09:46 +0000",2026-02-28
ALIQAN Technologies: Commerce Tools + Node JS + Cloud,https://weworkremotely.com/remote-jobs/aliqan-technologies-commerce-tools-node-js-cloud,"Mon, 02 Feb 2026 15:09:46 +0000",2026-02-28
Eran Group: Senior Back-End Web Developer,https://weworkremotely.com/remote-jobs/eran-group-senior-back-end-web-developer,"Mon, 02 Feb 2026 15:09:46 +0000",2026-02-28
Storetasker: Senior Shopify Developer (Remote + Flexible),https://weworkremotely.com/remote-jobs/storetasker-senior-shopify-developer-remote-flexible-3,"Mon, 13 May 2024 03:14:30 +0000",2026-02-28
"ServiceTitan: Manager, Web Development",https://weworkremotely.com/remote-jobs/servicetitan-manager-web-development,"Fri, 30 Jan 2026 18:50:50 +0000",2026-02-28
Codekeeper: Full Stack Developer (Javascript),https://weworkremotely.com/remote-jobs/codekeeper-full-stack-developer-javascript,"Fri, 30 Jan 2026 18:50:50 +0000",2026-02-28
Anexia Internetdienstleistungs: Ai/Ml Engineer – LLM Systems (M/W/D),https://weworkremotely.com/remote-jobs/anexia-internetdienstleistungs-ai-ml-engineer-llm-systems-m-w-d,"Fri, 30 Jan 2026 18:49:12 +0000",2026-02-28
Anexia Internetdienstleistungs: Data Engineer (M/W/D),https://weworkremotely.com/remote-jobs/anexia-internetdienstleistungs-data-engineer-m-w-d,"Fri, 30 Jan 2026 18:49:12 +0000",2026-02-28
JetBrains: JetBrains Web Developer Advocate (Developer Advocacy),https://weworkremotely.com/remote-jobs/jetbrains-jetbrains-web-developer-advocate-developer-advocacy,"Fri, 30 Jan 2026 18:49:12 +0000",2026-02-28
WALTER: Senior Software Engineer,https://weworkremotely.com/remote-jobs/walter-senior-software-engineer,"Thu, 29 Jan 2026 21:06:16 +0000",2026-02-28
Madeo: Web Developer (Contract) ,https://weworkremotely.com/remote-jobs/madeo-web-developer-contract,"Thu, 29 Jan 2026 20:32:53 +0000",2026-02-28
SlideSpeak: AI Software Engineer,https://weworkremotely.com/remote-jobs/slidespeak-ai-software-engineer,"Thu, 29 Jan 2026 12:53:34 +0000",2026-02-28
