Title,Link,Date_Posted,Scraped_At
GoFasti: Product Designer (UI/UX – Web Application),https://weworkremotely.com/remote-jobs/gofasti-product-designer-ui-ux-web-application,"Fri, 06 Feb 2026 15:57:25 +0000",2026-03-04
KOSATEC Empowering Global Innovation: Web Entwickler mit Schwerpunkt PHP (m/w/d),https://weworkremotely.com/remote-jobs/kosatec-empowering-global-innovation-web-entwickler-mit-schwerpunkt-php-m-w-d,"Fri, 06 Feb 2026 15:57:25 +0000",2026-03-04
"Speechify Inc: Software Engineer, macOS Core Product",https://weworkremotely.com/remote-jobs/speechify-inc-software-engineer-macos-core-product,"Wed, 07 Jan 2026 12:37:47 +0000",2026-03-04
Subscript: Software Engineer - Test,https://weworkremotely.com/remote-jobs/subscript-software-engineer-test,"Thu, 05 Feb 2026 19:57:18 +0000",2026-03-04
Anexia Internetdienstleistungs: 2Nd Level Support - Virtualization Stack (M/W/D),https://weworkremotely.com/remote-jobs/anexia-internetdienstleistungs-2nd-level-support-virtualization-stack-m-w-d,"Thu, 05 Feb 2026 17:00:18 +0000",2026-03-04
Engineering Comfort Solutions: Web Developer,https://weworkremotely.com/remote-jobs/engineering-comfort-solutions-web-developer,"Thu, 05 Feb 2026 17:00:18 +0000",2026-03-04
Gentia: Estrategista Comercial (Inside Sales),https://weworkremotely.com/remote-jobs/gentia-estrategista-comercial-inside-sales,"Thu, 05 Feb 2026 17:00:18 +0000",2026-03-04
Startupz.com: Front End Developer (HTML & CSS),https://weworkremotely.com/remote-jobs/startupz-com-front-end-developer-html-css,"Thu, 05 Feb 2026 17:00:18 +0000",2026-03-04
Uncanny Owl: WordPress Developer,https://weworkremotely.com/remote-jobs/uncanny-owl-wordpress-developer,"Wed, 04 Feb 2026 21:57:47 +0000",2026-03-04
Zipdev: Senior Web Developer,https://weworkremotely.com/remote-jobs/zipdev-senior-web-developer,"Wed, 04 Feb 2026 17:40:19 +0000",2026-03-04
"Linkage Web Development: ASP.NET Developer (C#, MVC, SQL Server, JavaScript)",https://weworkremotely.com/remote-jobs/linkage-web-development-asp-net-developer-c-mvc-sql-server-javascript,"Wed, 04 Feb 2026 17:40:19 +0000",2026-03-04
Anexia Internetdienstleistungs: QA Engineer (M/W/D),https://weworkremotely.com/remote-jobs/anexia-internetdienstleistungs-qa-engineer-m-w-d,"Wed, 04 Feb 2026 17:40:16 +0000",2026-03-04
"Speechify Inc: Software Engineer, iOS Core Product",https://weworkremotely.com/remote-jobs/speechify-inc-software-engineer-ios-core-product,"Wed, 09 Jul 2025 15:35:11 +0000",2026-03-04
Rapid Strategy: Senior Penetration Tester (WebApp and Network),https://weworkremotely.com/remote-jobs/rapid-strategy-senior-penetration-tester-webapp-and-network,"Tue, 03 Feb 2026 18:40:23 +0000",2026-03-04
"WeVote: Fundraiser, Volunteer Ambassador",https://weworkremotely.com/remote-jobs/wevote-fundraiser-volunteer-ambassador,"Tue, 03 Feb 2026 18:40:23 +0000",2026-03-04
OnTheGoSystems: Senior PHP Developer ,https://weworkremotely.com/remote-jobs/onthegosystems-senior-php-developer-3,"Tue, 03 Feb 2026 06:16:03 +0000",2026-03-04
Cortes 23: Software Engineer,https://weworkremotely.com/remote-jobs/cortes-23-software-engineer-3,"Mon, 02 Feb 2026 19:45:09 +0000",2026-03-04
DreamRider Productions Careers: Web Developer,https://weworkremotely.com/remote-jobs/dreamrider-productions-careers-web-developer,"Mon, 02 Feb 2026 15:10:52 +0000",2026-03-04
Walker Smith: Senior Web Developer (Remote),https://weworkremotely.com/remote-jobs/walker-smith-senior-web-developer-remote,"Mon, 02 Feb 2026 15:10:52 +0000",2026-03-04
Webflow: Enterprise Account Executive - West,https://weworkremotely.com/remote-jobs/webflow-enterprise-account-executive-west,"Mon, 02 Feb 2026 15:10:52 +0000",2026-03-04
Dealer eProcess: Regional Sales Executive (Account Manager),https://weworkremotely.com/remote-jobs/dealer-eprocess-regional-sales-executive-account-manager-1,"Mon, 02 Feb 2026 15:09:46 +0000",2026-03-04
NuTechs: FPGA Development Engineer,https://weworkremotely.com/remote-jobs/nutechs-fpga-development-engineer,"Mon, 02 Feb 2026 15:09:46 +0000",2026-03-04
ALIQAN Technologies: Commerce Tools + Node JS + Cloud,https://weworkremotely.com/remote-jobs/aliqan-technologies-commerce-tools-node-js-cloud,"Mon, 02 Feb 2026 15:09:46 +0000",2026-03-04
Eran Group: Senior Back-End Web Developer,https://weworkremotely.com/remote-jobs/eran-group-senior-back-end-web-developer,"Mon, 02 Feb 2026 15:09:46 +0000",2026-03-04
Storetasker: Senior Shopify Developer (Remote + Flexible),https://weworkremotely.com/remote-jobs/storetasker-senior-shopify-developer-remote-flexible-3,"Mon, 13 May 2024 03:14:30 +0000",2026-03-04
