Title,Link,Date_Posted,Scraped_At
EventMobi: Senior Front End Engineer - Remote,https://weworkremotely.com/remote-jobs/eventmobi-senior-front-end-engineer-remote-1,"Fri, 27 Mar 2026 17:07:25 +0000",2026-04-18
Sanctuary Computer: Senior Frontend Developer,https://weworkremotely.com/remote-jobs/sanctuary-computer-senior-frontend-developer-1,"Fri, 27 Mar 2026 16:28:28 +0000",2026-04-18
EngagedMD: Staff Software Engineer,https://weworkremotely.com/remote-jobs/engagedmd-staff-software-engineer,"Fri, 27 Mar 2026 14:03:38 +0000",2026-04-18
Cortes 23: Software Engineer,https://weworkremotely.com/remote-jobs/cortes-23-software-engineer-4,"Tue, 24 Feb 2026 15:35:41 +0000",2026-04-18
FINN: Lead Frontend Engineer,https://weworkremotely.com/remote-jobs/finn-lead-frontend-engineer,"Wed, 25 Mar 2026 21:35:33 +0000",2026-04-18
Cue: Senior Software Engineer,https://weworkremotely.com/remote-jobs/cue-senior-software-engineer,"Wed, 25 Mar 2026 20:21:42 +0000",2026-04-18
Aktor AI: (Senior) AI Solutions Engineer,https://weworkremotely.com/remote-jobs/aktor-ai-senior-ai-solutions-engineer,"Wed, 25 Mar 2026 09:35:22 +0000",2026-04-18
LeadUp AI: Full-Stack Developer (Junior),https://weworkremotely.com/remote-jobs/leadup-ai-full-stack-developer-junior,"Wed, 25 Mar 2026 02:14:15 +0000",2026-04-18
"Knack: Senior Frontend Engineer (React / Next.js) — Full-Time, Contract",https://weworkremotely.com/remote-jobs/knack-senior-frontend-engineer-react-next-js-full-time-contract,"Tue, 24 Mar 2026 19:28:57 +0000",2026-04-18
OnTheGoSystems: Full-Stack PHP Developer ,https://weworkremotely.com/remote-jobs/onthegosystems-full-stack-php-developer-1,"Mon, 23 Mar 2026 13:46:27 +0000",2026-04-18
Sticker Mule: Software engineer,https://weworkremotely.com/remote-jobs/sticker-mule-software-engineer-2,"Thu, 22 Jan 2026 13:45:49 +0000",2026-04-18
"Smart Working Solutions: Senior Full Stack Developer (Kotlin, Vue.js) (Remote, Full-Time) [AS197]",https://weworkremotely.com/remote-jobs/smart-working-solutions-senior-full-stack-developer-kotlin-vue-js-remote-full-time-as197,"Sun, 22 Mar 2026 20:32:14 +0000",2026-04-18
Moxie: Staff product engineer (fullstack) (IC-4),https://weworkremotely.com/remote-jobs/moxie-staff-product-engineer-fullstack-ic-4,"Sat, 21 Mar 2026 20:31:51 +0000",2026-04-18
Protect Democracy: Product / Engineer / Data Roles (Talent Community),https://weworkremotely.com/remote-jobs/protect-democracy-product-engineer-data-roles-talent-community,"Sat, 21 Mar 2026 20:31:40 +0000",2026-04-18
Virtasant: Senior Backend / Product Engineer  (AI Platform),https://weworkremotely.com/remote-jobs/virtasant-senior-backend-product-engineer-ai-platform,"Sat, 21 Mar 2026 20:31:30 +0000",2026-04-18
Releaf: CRO Design Specialist,https://weworkremotely.com/remote-jobs/releaf-cro-design-specialist,"Fri, 20 Mar 2026 20:35:03 +0000",2026-04-18
OrangeDot: Lead monday.com Consultant (CRM Product),https://weworkremotely.com/remote-jobs/orangedot-lead-monday-com-consultant-crm-product,"Fri, 20 Mar 2026 20:34:42 +0000",2026-04-18
Kdci: PIM Specialist (Product Information Specialist),https://weworkremotely.com/remote-jobs/kdci-pim-specialist-product-information-specialist,"Fri, 20 Mar 2026 20:34:36 +0000",2026-04-18
Phantom: Product Design (Wallet Platform),https://weworkremotely.com/remote-jobs/phantom-product-design-wallet-platform,"Fri, 20 Mar 2026 20:34:16 +0000",2026-04-18
CRUX: Full Stack Developer/Senior Full Stack/Lead,https://weworkremotely.com/remote-jobs/crux-full-stack-developer-senior-full-stack-lead,"Fri, 20 Mar 2026 20:32:19 +0000",2026-04-18
Creatunity Llc: Senior Full-Stack Developer (AI-Assisted Development) - Remote,https://weworkremotely.com/remote-jobs/creatunity-llc-senior-full-stack-developer-ai-assisted-development-remote,"Fri, 20 Mar 2026 20:31:56 +0000",2026-04-18
Stellar AI: Senior Software Engineer,https://weworkremotely.com/remote-jobs/stellar-ai-senior-software-engineer,"Tue, 21 Oct 2025 19:36:26 +0000",2026-04-18
Close: Senior Software Engineer - Backend/Python - USA Only (100% Remote),https://weworkremotely.com/remote-jobs/close-senior-software-engineer-backend-python-usa-only-100-remote-1,"Wed, 23 Jul 2025 14:31:54 +0000",2026-04-18
Vee Technologiesorporated: Product Engineering Operations Director,https://weworkremotely.com/remote-jobs/vee-technologiesorporated-product-engineering-operations-director,"Thu, 19 Mar 2026 20:31:29 +0000",2026-04-18
CloudDevs:  Java Developer - AI (Backend),https://weworkremotely.com/remote-jobs/clouddevs-java-developer-ai-backend,"Thu, 19 Mar 2026 15:08:14 +0000",2026-04-18
