Title,Link,Date_Posted,Scraped_At
Reveleer: Full Stack AI Engineer,https://weworkremotely.com/remote-jobs/reveleer-full-stack-ai-engineer,"Thu, 02 Apr 2026 20:46:00 +0000",2026-04-20
Grafana Labs: Staff Product Marketing Manager | United Kingdom | Remote,https://weworkremotely.com/remote-jobs/grafana-labs-staff-product-marketing-manager-united-kingdom-remote,"Thu, 02 Apr 2026 20:31:18 +0000",2026-04-20
Tether: AI Research Engineer,https://weworkremotely.com/remote-jobs/tether-ai-research-engineer,"Thu, 02 Apr 2026 20:28:59 +0000",2026-04-20
Level: Senior Frontend Engineer,https://weworkremotely.com/remote-jobs/level-senior-frontend-engineer,"Tue, 03 Mar 2026 17:26:57 +0000",2026-04-20
Bounteous: Principal Product Lead  MarTech AI,https://weworkremotely.com/remote-jobs/bounteous-principal-product-lead-martech-ai,"Wed, 01 Apr 2026 20:31:34 +0000",2026-04-20
EventMobi: Front End Engineer - Remote,https://weworkremotely.com/remote-jobs/eventmobi-front-end-engineer-remote,"Tue, 31 Mar 2026 18:28:48 +0000",2026-04-20
WALTER: Senior Software Engineer,https://weworkremotely.com/remote-jobs/walter-senior-software-engineer,"Thu, 29 Jan 2026 21:06:16 +0000",2026-04-20
ContentJet Inc.: Automation & Integration Engineer,https://weworkremotely.com/remote-jobs/contentjet-inc-automation-integration-engineer,"Mon, 30 Mar 2026 12:52:41 +0000",2026-04-20
ContentJet Inc.: AI Agent Architect / Builder,https://weworkremotely.com/remote-jobs/contentjet-inc-ai-agent-architect-builder,"Mon, 30 Mar 2026 12:49:53 +0000",2026-04-20
The Corvus Group Inc: React Frontend Developer,https://weworkremotely.com/remote-jobs/the-corvus-group-inc-react-frontend-developer,"Sun, 29 Mar 2026 00:27:27 +0000",2026-04-20
EventMobi: Senior Front End Engineer - Remote,https://weworkremotely.com/remote-jobs/eventmobi-senior-front-end-engineer-remote-1,"Fri, 27 Mar 2026 17:07:25 +0000",2026-04-20
Sanctuary Computer: Senior Frontend Developer,https://weworkremotely.com/remote-jobs/sanctuary-computer-senior-frontend-developer-1,"Fri, 27 Mar 2026 16:28:28 +0000",2026-04-20
EngagedMD: Staff Software Engineer,https://weworkremotely.com/remote-jobs/engagedmd-staff-software-engineer,"Fri, 27 Mar 2026 14:03:38 +0000",2026-04-20
Cortes 23: Software Engineer,https://weworkremotely.com/remote-jobs/cortes-23-software-engineer-4,"Tue, 24 Feb 2026 15:35:41 +0000",2026-04-20
FINN: Lead Frontend Engineer,https://weworkremotely.com/remote-jobs/finn-lead-frontend-engineer,"Wed, 25 Mar 2026 21:35:33 +0000",2026-04-20
Cue: Senior Software Engineer,https://weworkremotely.com/remote-jobs/cue-senior-software-engineer,"Wed, 25 Mar 2026 20:21:42 +0000",2026-04-20
Aktor AI: (Senior) AI Solutions Engineer,https://weworkremotely.com/remote-jobs/aktor-ai-senior-ai-solutions-engineer,"Wed, 25 Mar 2026 09:35:22 +0000",2026-04-20
LeadUp AI: Full-Stack Developer (Junior),https://weworkremotely.com/remote-jobs/leadup-ai-full-stack-developer-junior,"Wed, 25 Mar 2026 02:14:15 +0000",2026-04-20
"Knack: Senior Frontend Engineer (React / Next.js) — Full-Time, Contract",https://weworkremotely.com/remote-jobs/knack-senior-frontend-engineer-react-next-js-full-time-contract,"Tue, 24 Mar 2026 19:28:57 +0000",2026-04-20
OnTheGoSystems: Full-Stack PHP Developer ,https://weworkremotely.com/remote-jobs/onthegosystems-full-stack-php-developer-1,"Mon, 23 Mar 2026 13:46:27 +0000",2026-04-20
Sticker Mule: Software engineer,https://weworkremotely.com/remote-jobs/sticker-mule-software-engineer-2,"Thu, 22 Jan 2026 13:45:49 +0000",2026-04-20
"Smart Working Solutions: Senior Full Stack Developer (Kotlin, Vue.js) (Remote, Full-Time) [AS197]",https://weworkremotely.com/remote-jobs/smart-working-solutions-senior-full-stack-developer-kotlin-vue-js-remote-full-time-as197,"Sun, 22 Mar 2026 20:32:14 +0000",2026-04-20
Moxie: Staff product engineer (fullstack) (IC-4),https://weworkremotely.com/remote-jobs/moxie-staff-product-engineer-fullstack-ic-4,"Sat, 21 Mar 2026 20:31:51 +0000",2026-04-20
Protect Democracy: Product / Engineer / Data Roles (Talent Community),https://weworkremotely.com/remote-jobs/protect-democracy-product-engineer-data-roles-talent-community,"Sat, 21 Mar 2026 20:31:40 +0000",2026-04-20
Virtasant: Senior Backend / Product Engineer  (AI Platform),https://weworkremotely.com/remote-jobs/virtasant-senior-backend-product-engineer-ai-platform,"Sat, 21 Mar 2026 20:31:30 +0000",2026-04-20
