Title,Link,Date_Posted,Scraped_At
"Titan Ai: Full-Stack Developer, AI Applications",https://weworkremotely.com/remote-jobs/titan-ai-full-stack-developer-ai-applications,"Wed, 08 Apr 2026 20:32:08 +0000",2026-05-04
"Samsara: Senior Sales Strategy Manager, New Product",https://weworkremotely.com/remote-jobs/samsara-senior-sales-strategy-manager-new-product,"Wed, 08 Apr 2026 20:32:00 +0000",2026-05-04
Philo: Lead Backend Software Engineer (Product API),https://weworkremotely.com/remote-jobs/philo-lead-backend-software-engineer-product-api,"Wed, 08 Apr 2026 20:31:03 +0000",2026-05-04
Chooose: Engagement Manager (US - ET),https://weworkremotely.com/remote-jobs/chooose-engagement-manager-us-et,"Wed, 08 Apr 2026 08:11:30 +0000",2026-05-04
31 Green Ltd: Full Stack Developer - Backend Focus,https://weworkremotely.com/remote-jobs/31-green-ltd-full-stack-developer-backend-focus,"Tue, 07 Apr 2026 20:34:46 +0000",2026-05-04
act digital: Full-stack Developer (SP),https://weworkremotely.com/remote-jobs/act-digital-full-stack-developer-sp,"Tue, 07 Apr 2026 20:33:41 +0000",2026-05-04
Manifest Cyber Public: Senior Backend Application Engineer - Product & Platform,https://weworkremotely.com/remote-jobs/manifest-cyber-public-senior-backend-application-engineer-product-platform,"Tue, 07 Apr 2026 20:32:52 +0000",2026-05-04
Miragon: Full Stack Developer (m/w/d),https://weworkremotely.com/remote-jobs/miragon-full-stack-developer-m-w-d,"Tue, 07 Apr 2026 20:31:03 +0000",2026-05-04
A.Team: Senior Independent Software Developer ($90-$170/hr),https://weworkremotely.com/remote-jobs/a-team-senior-independent-software-developer-90-170-hr,"Sun, 16 Jun 2024 17:30:51 +0000",2026-05-04
CloudDevs: Full-stack/Backend developers LLM focused.,https://weworkremotely.com/remote-jobs/clouddevs-full-stack-backend-developers-llm-focused,"Tue, 07 Apr 2026 17:04:23 +0000",2026-05-04
Treehouse Job Board: Electrical Design Lead,https://weworkremotely.com/remote-jobs/treehouse-job-board-electrical-design-lead,"Mon, 06 Apr 2026 20:32:03 +0000",2026-05-04
Trace3: Sr. Cloud Solutions Architect | DevOps (Remote),https://weworkremotely.com/remote-jobs/trace3-sr-cloud-solutions-architect-devops-remote,"Mon, 06 Apr 2026 20:31:29 +0000",2026-05-04
Veeva Systems: Data Product Manager - Link Activity Data,https://weworkremotely.com/remote-jobs/veeva-systems-data-product-manager-link-activity-data-1,"Mon, 06 Apr 2026 20:31:15 +0000",2026-05-04
Veeva Systems: Data Product Manager - Link Activity Data,https://weworkremotely.com/remote-jobs/veeva-systems-data-product-manager-link-activity-data,"Mon, 06 Apr 2026 20:31:11 +0000",2026-05-04
1nce: Product Owner Frontend (all),https://weworkremotely.com/remote-jobs/1nce-product-owner-frontend-all,"Mon, 06 Apr 2026 18:04:22 +0000",2026-05-04
Carbmee: (Senior) Product Manager (all genders) | ClimateTech,https://weworkremotely.com/remote-jobs/carbmee-senior-product-manager-all-genders-climatetech,"Mon, 06 Apr 2026 18:03:24 +0000",2026-05-04
Ataccama: Senior Back-End Engineer (Java) - Product Foundation,https://weworkremotely.com/remote-jobs/ataccama-senior-back-end-engineer-java-product-foundation,"Mon, 06 Apr 2026 18:03:08 +0000",2026-05-04
Celonis: Application Product Manager - Accounts Payable,https://weworkremotely.com/remote-jobs/celonis-application-product-manager-accounts-payable,"Mon, 06 Apr 2026 18:03:08 +0000",2026-05-04
Instructure: Principal Product Specialist,https://weworkremotely.com/remote-jobs/instructure-principal-product-specialist,"Mon, 06 Apr 2026 18:02:58 +0000",2026-05-04
Workwize: Product Manager b2b SaaS,https://weworkremotely.com/remote-jobs/workwize-product-manager-b2b-saas,"Mon, 06 Apr 2026 18:02:58 +0000",2026-05-04
"Speechify: Software Engineer, Web Core Product & Chrome Extension",https://weworkremotely.com/remote-jobs/speechify-software-engineer-web-core-product-chrome-extension,"Mon, 06 Apr 2026 18:02:14 +0000",2026-05-04
Elevated Leads Limited: Chrome Extension Developer — iGaming Product (New Build),https://weworkremotely.com/remote-jobs/elevated-leads-limited-chrome-extension-developer-igaming-product-new-build,"Mon, 06 Apr 2026 10:20:00 +0000",2026-05-04
8am: Product Designer | Growth,https://weworkremotely.com/remote-jobs/8am-product-designer-growth,"Sun, 05 Apr 2026 20:31:38 +0000",2026-05-04
"Stripe: Staff Product Manager, Link Consumer Product",https://weworkremotely.com/remote-jobs/stripe-staff-product-manager-link-consumer-product,"Sun, 05 Apr 2026 20:31:33 +0000",2026-05-04
"Speechify Inc: Software Engineer, iOS Core Product",https://weworkremotely.com/remote-jobs/speechify-inc-software-engineer-ios-core-product,"Wed, 09 Jul 2025 15:35:11 +0000",2026-05-04
