Title,Link,Date_Posted,Scraped_At
Business-staffing-of-america-inc: Notice Design Lead (Fully Remote),https://weworkremotely.com/remote-jobs/business-staffing-of-america-inc-notice-design-lead-fully-remote-3,"Fri, 06 Mar 2026 16:04:48 +0000",2026-04-02
Business-staffing-of-america-inc: Notice Design Lead (Fully Remote),https://weworkremotely.com/remote-jobs/business-staffing-of-america-inc-notice-design-lead-fully-remote-1,"Fri, 06 Mar 2026 16:04:34 +0000",2026-04-02
Mrp My Recruitment Partners: Full Stack Developer mit Erfahrung in Shopware 6 (all genders) - Köln,https://weworkremotely.com/remote-jobs/mrp-my-recruitment-partners-full-stack-developer-mit-erfahrung-in-shopware-6-all-genders-1,"Fri, 06 Mar 2026 16:04:07 +0000",2026-04-02
Mrp My Recruitment Partners: Full Stack Developer mit Erfahrung in Shopware 6 (all genders),https://weworkremotely.com/remote-jobs/mrp-my-recruitment-partners-full-stack-developer-mit-erfahrung-in-shopware-6-all-genders,"Fri, 06 Mar 2026 16:03:39 +0000",2026-04-02
Hyphen Connect Limited: Web3 Full Stack Developer,https://weworkremotely.com/remote-jobs/hyphen-connect-limited-web3-full-stack-developer-1,"Fri, 06 Mar 2026 16:02:40 +0000",2026-04-02
Java & React: Full Stack Developer  Java & React (100% remote),https://weworkremotely.com/remote-jobs/java-react-full-stack-developer-java-react-100-remote,"Fri, 06 Mar 2026 16:02:40 +0000",2026-04-02
Hyphen Connect Limited: Web3 Full Stack Developer,https://weworkremotely.com/remote-jobs/hyphen-connect-limited-web3-full-stack-developer,"Fri, 06 Mar 2026 16:02:31 +0000",2026-04-02
"Renesas Electronics: Principal Engineer,SOC Physical Design",https://weworkremotely.com/remote-jobs/renesas-electronics-principal-engineer-soc-physical-design,"Fri, 06 Mar 2026 16:02:30 +0000",2026-04-02
Granicus: Sr. Design Services Engineer,https://weworkremotely.com/remote-jobs/granicus-sr-design-services-engineer,"Fri, 06 Mar 2026 16:02:05 +0000",2026-04-02
"Speechify Inc: Software Engineer, iOS Core Product",https://weworkremotely.com/remote-jobs/speechify-inc-software-engineer-ios-core-product,"Wed, 09 Jul 2025 15:35:11 +0000",2026-04-02
Activate Talent: Product Merchandising Specialist,https://weworkremotely.com/remote-jobs/activate-talent-product-merchandising-specialist,"Thu, 05 Mar 2026 16:45:20 +0000",2026-04-02
Sitetracker: Product Knowledge Lead,https://weworkremotely.com/remote-jobs/sitetracker-product-knowledge-lead,"Thu, 05 Mar 2026 16:45:20 +0000",2026-04-02
Selefor: Senior Full Stack Developer C++ Direttore Tecnico,https://weworkremotely.com/remote-jobs/selefor-senior-full-stack-developer-cpp-direttore-tecnico,"Thu, 05 Mar 2026 16:45:17 +0000",2026-04-02
Contentserv: Full Stack Developer (gn),https://weworkremotely.com/remote-jobs/contentserv-full-stack-developer-gn,"Thu, 05 Mar 2026 16:45:17 +0000",2026-04-02
"Hector Kitchen: Full Stack Developer (Low-Code, Bubble.io)",https://weworkremotely.com/remote-jobs/hector-kitchen-full-stack-developer-low-code-bubble-io,"Thu, 05 Mar 2026 16:45:16 +0000",2026-04-02
"Bold & Epic Craft Llc: Full Stack Developer (PHP, Laravel, WordPress & JavaScript)",https://weworkremotely.com/remote-jobs/bold-epic-craft-llc-full-stack-developer-php-laravel-wordpress-javascript,"Thu, 05 Mar 2026 16:45:16 +0000",2026-04-02
Mercury: Senior Backend Engineer - Product,https://weworkremotely.com/remote-jobs/mercury-senior-backend-engineer-product,"Thu, 05 Mar 2026 16:06:36 +0000",2026-04-02
Turing: Systemverilog Hardware Design Developer,https://weworkremotely.com/remote-jobs/turing-systemverilog-hardware-design-developer,"Wed, 04 Mar 2026 16:43:56 +0000",2026-04-02
Singular: Product Support Escalations Engineer,https://weworkremotely.com/remote-jobs/singular-product-support-escalations-engineer,"Wed, 04 Mar 2026 16:43:56 +0000",2026-04-02
Epilot: Senior/Staff Product Engineer (Full Stack) (m/f/d),https://weworkremotely.com/remote-jobs/epilot-senior-staff-product-engineer-full-stack-m-f-d,"Wed, 04 Mar 2026 16:43:53 +0000",2026-04-02
Railway: Senior Full-Stack Engineer - Product,https://weworkremotely.com/remote-jobs/railway-senior-full-stack-engineer-product,"Wed, 04 Mar 2026 16:43:50 +0000",2026-04-02
Jump: Join the Jump Product & Design Talent Pool,https://weworkremotely.com/remote-jobs/jump-join-the-jump-product-design-talent-pool,"Wed, 04 Mar 2026 16:43:50 +0000",2026-04-02
Storetasker: Senior Shopify Developer (Remote + Flexible),https://weworkremotely.com/remote-jobs/storetasker-senior-shopify-developer-remote-flexible-3,"Mon, 13 May 2024 03:14:30 +0000",2026-04-02
Level: Senior Frontend Engineer,https://weworkremotely.com/remote-jobs/level-senior-frontend-engineer,"Tue, 03 Mar 2026 17:26:57 +0000",2026-04-02
Lemon.io: Senior React Full-stack Developer,https://weworkremotely.com/remote-jobs/lemon-io-senior-react-full-stack-developer-3,"Tue, 03 Mar 2026 15:53:39 +0000",2026-04-02
