Title,Link,Date_Posted,Scraped_At
C4Media: Frontend Developer,https://weworkremotely.com/remote-jobs/c4media-frontend-developer,"Tue, 10 Mar 2026 16:25:58 +0000",2026-04-05
Ivy Tech: Full Stack Engineer,https://weworkremotely.com/remote-jobs/ivy-tech-full-stack-engineer,"Tue, 10 Mar 2026 13:52:50 +0000",2026-04-05
Attio: Senior Product Engineer [Backend],https://weworkremotely.com/remote-jobs/attio-senior-product-engineer-backend,"Mon, 09 Mar 2026 20:33:12 +0000",2026-04-05
Agentic Dream: Senior Full Stack Developer (Java),https://weworkremotely.com/remote-jobs/agentic-dream-senior-full-stack-developer-java,"Mon, 09 Mar 2026 20:32:36 +0000",2026-04-05
Kasama: Salesforce Cloud Commerce Full Stack Developer,https://weworkremotely.com/remote-jobs/kasama-salesforce-cloud-commerce-full-stack-developer,"Sun, 08 Mar 2026 20:46:01 +0000",2026-04-05
Appetiser: Part-Time Full-Stack Developer (Laravel and VueJS),https://weworkremotely.com/remote-jobs/appetiser-part-time-full-stack-developer-laravel-and-vuejs,"Sun, 08 Mar 2026 20:46:01 +0000",2026-04-05
A.Team: Senior Independent Software Developer ($90-$170/hr),https://weworkremotely.com/remote-jobs/a-team-senior-independent-software-developer-90-170-hr,"Sun, 16 Jun 2024 17:30:51 +0000",2026-04-05
"Speechify Inc: Software Engineer, macOS Core Product",https://weworkremotely.com/remote-jobs/speechify-inc-software-engineer-macos-core-product,"Wed, 07 Jan 2026 12:37:47 +0000",2026-04-05
"Dropbox: Staff Backend Product Software Engineer, Core Sync",https://weworkremotely.com/remote-jobs/dropbox-staff-backend-product-software-engineer-core-sync,"Sat, 07 Mar 2026 20:45:00 +0000",2026-04-05
Stratum AI: 3D Product Interface Designer (Contractor),https://weworkremotely.com/remote-jobs/stratum-ai-3d-product-interface-designer-contractor,"Sat, 07 Mar 2026 20:44:56 +0000",2026-04-05
Uncanny Owl: WordPress Developer,https://weworkremotely.com/remote-jobs/uncanny-owl-wordpress-developer,"Wed, 04 Feb 2026 21:57:47 +0000",2026-04-05
Tidal: PHL - Full-Stack Developer,https://weworkremotely.com/remote-jobs/tidal-phl-full-stack-developer,"Fri, 06 Mar 2026 20:43:04 +0000",2026-04-05
Mrp My Recruitment Partners: Full Stack Developer mit Erfahrung in Shopware 6 (all genders) - 100% remote oder hybrid,https://weworkremotely.com/remote-jobs/mrp-my-recruitment-partners-full-stack-developer-mit-erfahrung-in-shopware-6-all-genders-2,"Fri, 06 Mar 2026 20:43:02 +0000",2026-04-05
Mrp My Recruitment Partners: German speaking Full Stack Developer mit Erfahrung in Shopware 6 (all genders) - 100% remote,https://weworkremotely.com/remote-jobs/mrp-my-recruitment-partners-german-speaking-full-stack-developer-mit-erfahrung-in-shopware-6-all,"Fri, 06 Mar 2026 20:43:01 +0000",2026-04-05
"Senex: Full Stack Developer (PHP, React, MySQL)",https://weworkremotely.com/remote-jobs/senex-full-stack-developer-php-react-mysql,"Fri, 06 Mar 2026 16:05:00 +0000",2026-04-05
Business-staffing-of-america-inc: Notice Design Lead (Fully Remote),https://weworkremotely.com/remote-jobs/business-staffing-of-america-inc-notice-design-lead-fully-remote-3,"Fri, 06 Mar 2026 16:04:48 +0000",2026-04-05
Business-staffing-of-america-inc: Notice Design Lead (Fully Remote),https://weworkremotely.com/remote-jobs/business-staffing-of-america-inc-notice-design-lead-fully-remote-1,"Fri, 06 Mar 2026 16:04:34 +0000",2026-04-05
Mrp My Recruitment Partners: Full Stack Developer mit Erfahrung in Shopware 6 (all genders) - Köln,https://weworkremotely.com/remote-jobs/mrp-my-recruitment-partners-full-stack-developer-mit-erfahrung-in-shopware-6-all-genders-1,"Fri, 06 Mar 2026 16:04:07 +0000",2026-04-05
Mrp My Recruitment Partners: Full Stack Developer mit Erfahrung in Shopware 6 (all genders),https://weworkremotely.com/remote-jobs/mrp-my-recruitment-partners-full-stack-developer-mit-erfahrung-in-shopware-6-all-genders,"Fri, 06 Mar 2026 16:03:39 +0000",2026-04-05
Hyphen Connect Limited: Web3 Full Stack Developer,https://weworkremotely.com/remote-jobs/hyphen-connect-limited-web3-full-stack-developer-1,"Fri, 06 Mar 2026 16:02:40 +0000",2026-04-05
Java & React: Full Stack Developer  Java & React (100% remote),https://weworkremotely.com/remote-jobs/java-react-full-stack-developer-java-react-100-remote,"Fri, 06 Mar 2026 16:02:40 +0000",2026-04-05
Hyphen Connect Limited: Web3 Full Stack Developer,https://weworkremotely.com/remote-jobs/hyphen-connect-limited-web3-full-stack-developer,"Fri, 06 Mar 2026 16:02:31 +0000",2026-04-05
"Renesas Electronics: Principal Engineer,SOC Physical Design",https://weworkremotely.com/remote-jobs/renesas-electronics-principal-engineer-soc-physical-design,"Fri, 06 Mar 2026 16:02:30 +0000",2026-04-05
Granicus: Sr. Design Services Engineer,https://weworkremotely.com/remote-jobs/granicus-sr-design-services-engineer,"Fri, 06 Mar 2026 16:02:05 +0000",2026-04-05
"Speechify Inc: Software Engineer, iOS Core Product",https://weworkremotely.com/remote-jobs/speechify-inc-software-engineer-ios-core-product,"Wed, 09 Jul 2025 15:35:11 +0000",2026-04-05
