Title,Link,Date_Posted,Scraped_At
AHU Technologies: SR Project Manager in Continuous Improvement with Health Experience,https://weworkremotely.com/remote-jobs/ahu-technologies-sr-project-manager-in-continuous-improvement-with-health-experience,"Tue, 17 Feb 2026 22:19:58 +0000",2026-03-14
"Magic: Web Development & Coding Specialist - Freelance, Remote",https://weworkremotely.com/remote-jobs/magic-web-development-coding-specialist-freelance-remote,"Tue, 17 Feb 2026 22:19:58 +0000",2026-03-14
"Shado Ventures: Senior ML Engineer - AI Document Intelligence (Remote, $15K Contract)",https://weworkremotely.com/remote-jobs/shado-ventures-senior-ml-engineer-ai-document-intelligence-remote-15k-contract,"Tue, 17 Feb 2026 14:37:01 +0000",2026-03-14
Proton.ai: Senior Backend Engineer,https://weworkremotely.com/remote-jobs/proton-ai-senior-backend-engineer,"Wed, 22 Jan 2025 23:59:57 +0000",2026-03-14
Dusk Labs: Security Engineer  - Research & Test,https://weworkremotely.com/remote-jobs/dusk-labs-security-engineer-research-test,"Mon, 16 Feb 2026 19:35:48 +0000",2026-03-14
Proxify AB: Senior Backend Developer (Python),https://weworkremotely.com/remote-jobs/proxify-ab-senior-backend-developer-python-7,"Mon, 16 Feb 2026 11:17:19 +0000",2026-03-14
Proxify AB: Senior Backend Developer (Node.js / Nest.js),https://weworkremotely.com/remote-jobs/proxify-ab-senior-backend-developer-node-js-nest-js-2,"Mon, 16 Feb 2026 11:13:15 +0000",2026-03-14
Proxify AB: Senior Fullstack Developer (Python),https://weworkremotely.com/remote-jobs/proxify-ab-senior-fullstack-developer-python-2,"Mon, 16 Feb 2026 11:11:26 +0000",2026-03-14
Dusk Labs: Test Engineer,https://weworkremotely.com/remote-jobs/dusk-labs-test-engineer,"Mon, 16 Feb 2026 05:27:51 +0000",2026-03-14
ALIQAN Technologies: Data Engineer,https://weworkremotely.com/remote-jobs/aliqan-technologies-data-engineer,"Fri, 13 Feb 2026 22:01:39 +0000",2026-03-14
Blockchain & Climate Institute: UNPAID VOLUNTEER - Web Developer,https://weworkremotely.com/remote-jobs/blockchain-climate-institute-unpaid-volunteer-web-developer,"Fri, 13 Feb 2026 22:01:39 +0000",2026-03-14
"Yoko Co: Development Contractors (Full Stack, Front-End, Back-End)",https://weworkremotely.com/remote-jobs/yoko-co-development-contractors-full-stack-front-end-back-end,"Fri, 13 Feb 2026 20:06:45 +0000",2026-03-14
OnTheGoSystems: Senior Ruby on Rails Developer,https://weworkremotely.com/remote-jobs/onthegosystems-senior-ruby-on-rails-developer-1,"Fri, 13 Feb 2026 16:31:19 +0000",2026-03-14
"ORGA-SOFT: Senior Frontend Software Developer (m/w/d) - React, GraphQL & Progressive Web Apps (PWA)",https://weworkremotely.com/remote-jobs/orga-soft-senior-frontend-software-developer-m-w-d-react-graphql-progressive-web-apps-pwa,"Thu, 12 Feb 2026 22:08:55 +0000",2026-03-14
EBG: PHP Web Application Developer (API),https://weworkremotely.com/remote-jobs/ebg-php-web-application-developer-api,"Thu, 12 Feb 2026 22:08:55 +0000",2026-03-14
WeVote: Donor Communications Specialist,https://weworkremotely.com/remote-jobs/wevote-donor-communications-specialist,"Thu, 12 Feb 2026 22:08:55 +0000",2026-03-14
Cotiviti: Sdet,https://weworkremotely.com/remote-jobs/cotiviti-sdet-1,"Thu, 12 Feb 2026 22:08:50 +0000",2026-03-14
Akamai: Senior Software Engineer,https://weworkremotely.com/remote-jobs/akamai-senior-software-engineer,"Thu, 12 Feb 2026 22:08:50 +0000",2026-03-14
Varicent: Web Application Engineer (Remote - Mexico Only),https://weworkremotely.com/remote-jobs/varicent-web-application-engineer-remote-mexico-only,"Thu, 12 Feb 2026 22:08:50 +0000",2026-03-14
Agility Technologies: Web Developer (React/Angular|Responsive & Accessible Web Application),https://weworkremotely.com/remote-jobs/agility-technologies-web-developer-react-angular-responsive-accessible-web-application,"Thu, 12 Feb 2026 22:08:50 +0000",2026-03-14
Cyberpuerta: Frontend Web Developer,https://weworkremotely.com/remote-jobs/cyberpuerta-frontend-web-developer,"Thu, 12 Feb 2026 15:40:38 +0000",2026-03-14
Digital Resource: Web Developer,https://weworkremotely.com/remote-jobs/digital-resource-web-developer,"Thu, 12 Feb 2026 15:40:38 +0000",2026-03-14
Steady Vision: Web Developer,https://weworkremotely.com/remote-jobs/steady-vision-web-developer,"Thu, 12 Feb 2026 15:40:38 +0000",2026-03-14
Lemon.io: Senior Java Full-stack Developer,https://weworkremotely.com/remote-jobs/lemon-io-senior-java-full-stack-developer,"Thu, 12 Feb 2026 13:12:09 +0000",2026-03-14
Proxify AB: Senior Next.js Developer,https://weworkremotely.com/remote-jobs/proxify-ab-senior-next-js-developer-5,"Thu, 12 Feb 2026 11:18:32 +0000",2026-03-14
