Title,Link,Date_Posted,Scraped_At
Mesh: Director of Product Money Movement,https://weworkremotely.com/remote-jobs/mesh-director-of-product-money-movement,"Tue, 17 Mar 2026 20:31:34 +0000",2026-04-07
Yoko Co: WordPress Support Engineer,https://weworkremotely.com/remote-jobs/yoko-co-wordpress-support-engineer,"Tue, 17 Mar 2026 13:01:49 +0000",2026-04-07
Strange Loop Labs: Senior Software Engineer,https://weworkremotely.com/remote-jobs/strange-loop-labs-senior-software-engineer,"Tue, 17 Mar 2026 06:05:35 +0000",2026-04-07
Rare Days: Full-Stack Engineering Lead,https://weworkremotely.com/remote-jobs/rare-days-full-stack-engineering-lead,"Tue, 17 Mar 2026 00:18:00 +0000",2026-04-07
"Confluent: Senior Manager, Product-Led Growth Strategy and Operations",https://weworkremotely.com/remote-jobs/confluent-senior-manager-product-led-growth-strategy-and-operations,"Sun, 15 Mar 2026 20:31:52 +0000",2026-04-07
Master-works: Full-stack Developer (React & Node.js),https://weworkremotely.com/remote-jobs/master-works-full-stack-developer-react-node-js,"Sat, 14 Mar 2026 20:32:00 +0000",2026-04-07
ClickGUARD Inc.: AI Process Optimization Lead,https://weworkremotely.com/remote-jobs/clickguard-inc-ai-process-optimization-lead,"Fri, 13 Mar 2026 17:21:55 +0000",2026-04-07
Sanctuary Computer: Senior Firmware Engineer,https://weworkremotely.com/remote-jobs/sanctuary-computer-senior-firmware-engineer,"Fri, 13 Mar 2026 13:16:56 +0000",2026-04-07
ELECTE S.R.L.: Full-Stack Developer,https://weworkremotely.com/remote-jobs/electe-s-r-l-full-stack-developer,"Fri, 13 Mar 2026 10:52:07 +0000",2026-04-07
Mobena: Frontend Engineer,https://weworkremotely.com/remote-jobs/mobena-frontend-engineer,"Fri, 16 May 2025 20:03:34 +0000",2026-04-07
"CodeSignal: Software Engineer, Business Experience",https://weworkremotely.com/remote-jobs/codesignal-software-engineer-business-experience-1,"Wed, 12 Nov 2025 08:56:02 +0000",2026-04-07
"Confluent: Senior Product Manager, Confluent Cloud Kafka",https://weworkremotely.com/remote-jobs/confluent-senior-product-manager-confluent-cloud-kafka,"Wed, 11 Mar 2026 20:32:16 +0000",2026-04-07
European Dynamics: .NET Full Stack Developer (Power Platform specialization),https://weworkremotely.com/remote-jobs/european-dynamics-net-full-stack-developer-power-platform-specialization,"Wed, 11 Mar 2026 20:31:42 +0000",2026-04-07
Microventures: Senior Full Stack Developer (Laravel + Vue.js),https://weworkremotely.com/remote-jobs/microventures-senior-full-stack-developer-laravel-vue-js,"Wed, 11 Mar 2026 20:31:37 +0000",2026-04-07
Workana: Jr Product Administrator,https://weworkremotely.com/remote-jobs/workana-jr-product-administrator,"Tue, 10 Mar 2026 20:36:13 +0000",2026-04-07
"Dropbox: Staff Product Backend Software Engineer, Core Sync",https://weworkremotely.com/remote-jobs/dropbox-staff-product-backend-software-engineer-core-sync,"Tue, 10 Mar 2026 20:35:27 +0000",2026-04-07
Abstrabit Technologies: Full Stack Developer Intern (AI Focus | Class of 2025 | Conversion Opportunity),https://weworkremotely.com/remote-jobs/abstrabit-technologies-full-stack-developer-intern-ai-focus-class-of-2025-conversion-opportunity,"Tue, 10 Mar 2026 20:34:15 +0000",2026-04-07
C4Media: Frontend Developer,https://weworkremotely.com/remote-jobs/c4media-frontend-developer,"Tue, 10 Mar 2026 16:25:58 +0000",2026-04-07
Ivy Tech: Full Stack Engineer,https://weworkremotely.com/remote-jobs/ivy-tech-full-stack-engineer,"Tue, 10 Mar 2026 13:52:50 +0000",2026-04-07
Attio: Senior Product Engineer [Backend],https://weworkremotely.com/remote-jobs/attio-senior-product-engineer-backend,"Mon, 09 Mar 2026 20:33:12 +0000",2026-04-07
Agentic Dream: Senior Full Stack Developer (Java),https://weworkremotely.com/remote-jobs/agentic-dream-senior-full-stack-developer-java,"Mon, 09 Mar 2026 20:32:36 +0000",2026-04-07
Kasama: Salesforce Cloud Commerce Full Stack Developer,https://weworkremotely.com/remote-jobs/kasama-salesforce-cloud-commerce-full-stack-developer,"Sun, 08 Mar 2026 20:46:01 +0000",2026-04-07
Appetiser: Part-Time Full-Stack Developer (Laravel and VueJS),https://weworkremotely.com/remote-jobs/appetiser-part-time-full-stack-developer-laravel-and-vuejs,"Sun, 08 Mar 2026 20:46:01 +0000",2026-04-07
A.Team: Senior Independent Software Developer ($90-$170/hr),https://weworkremotely.com/remote-jobs/a-team-senior-independent-software-developer-90-170-hr,"Sun, 16 Jun 2024 17:30:51 +0000",2026-04-07
"Speechify Inc: Software Engineer, macOS Core Product",https://weworkremotely.com/remote-jobs/speechify-inc-software-engineer-macos-core-product,"Wed, 07 Jan 2026 12:37:47 +0000",2026-04-07
